Category,Descript,Count
ARSON,ARSON,1266
ARSON,ARSON OF A COMMERCIAL BUILDING,173
ARSON,ARSON OF A POLICE BUILDING,6
ARSON,ARSON OF A POLICE VEHICLE,3
ARSON,ARSON OF A VACANT BUILDING,78
ARSON,ARSON OF A VEHICLE,1476
ARSON,ARSON OF AN INHABITED DWELLING,515
ARSON,ARSON WITH GREAT BODILY INJURY,6
ARSON,ATTEMPTED ARSON,299
ARSON,"FIRE, UNLAWFULLY CAUSING",109
ASSAULT,"AGGRAVATED ASSAULT OF POLICE OFFICER, SNIPING",2
ASSAULT,"AGGRAVATED ASSAULT OF POLICE OFFICER,BODILY FORCE",391
ASSAULT,AGGRAVATED ASSAULT ON POLICE OFFICER WITH A GUN,15
ASSAULT,AGGRAVATED ASSAULT ON POLICE OFFICER WITH A KNIFE,56
ASSAULT,AGGRAVATED ASSAULT WITH A DEADLY WEAPON,16405
ASSAULT,AGGRAVATED ASSAULT WITH A GUN,2556
ASSAULT,AGGRAVATED ASSAULT WITH A KNIFE,6073
ASSAULT,AGGRAVATED ASSAULT WITH BODILY FORCE,12522
ASSAULT,ASSAULT,1299
ASSAULT,ASSAULT BY POISONING,19
ASSAULT,ASSAULT BY POLICE OFFICER,10
ASSAULT,ASSAULT ON A POLICE OFFICER WITH A DEADLY WEAPON,565
ASSAULT,ASSAULT OR ATTEMPTED MURDER UPON GOV'T OFFICERS,4
ASSAULT,ASSAULT WITH CAUSTIC CHEMICALS,1092
ASSAULT,"ASSAULT, AGGRAVATED, ON POLICE OFFICER, W/ FULL AUTO",1
ASSAULT,"ASSAULT, AGGRAVATED, ON POLICE OFFICER, W/ GUN",29
ASSAULT,"ASSAULT, AGGRAVATED, ON POLICE OFFICER, W/ SEMI AUTO",1
ASSAULT,"ASSAULT, AGGRAVATED, W/ GUN",608
ASSAULT,"ASSAULT, AGGRAVATED, W/ MACHINE GUN",5
ASSAULT,"ASSAULT, AGGRAVATED, W/ SEMI AUTO",11
ASSAULT,ATTEMPTED HOMICIDE BY SNIPING,1
ASSAULT,ATTEMPTED HOMICIDE WITH A DANGEROUS WEAPON,207
ASSAULT,ATTEMPTED HOMICIDE WITH A GUN,768
ASSAULT,ATTEMPTED HOMICIDE WITH A KNIFE,446
ASSAULT,ATTEMPTED HOMICIDE WITH BODILY FORCE,117
ASSAULT,ATTEMPTED HOMICIDE WITH EXPLOSIVES,2
ASSAULT,ATTEMPTED MAYHEM WITH A DEADLY WEAPON,56
ASSAULT,ATTEMPTED MAYHEM WITH A GUN,3
ASSAULT,ATTEMPTED MAYHEM WITH A KNIFE,33
ASSAULT,ATTEMPTED MAYHEM WITH BODILY FORCE,23
ASSAULT,ATTEMPTED SIMPLE ASSAULT,861
ASSAULT,BATTERY,67654
ASSAULT,BATTERY DURING LABOR DISPUTE,31
ASSAULT,BATTERY OF A POLICE OFFICER,3199
ASSAULT,BATTERY WITH SERIOUS INJURIES,2377
ASSAULT,"BATTERY, FORMER SPOUSE OR DATING RELATIONSHIP",8784
ASSAULT,CHILD ABUSE (PHYSICAL),3607
ASSAULT,"CHILD, INFLICTING INJURY RESULTING IN TRAUMATIC CONDITION",407
ASSAULT,"CIVIL RIGHTS, INCL. INJURY, THREAT, OR DAMAGE (HATE CRIMES)",21
ASSAULT,DISCHARGING IN GROSSLY NEGLIGENT MANNER,306
ASSAULT,ELDER ADULT OR DEPENDENT ABUSE (NOT EMBEZZLEMENT OR THEFT),2215
ASSAULT,FALSE IMPRISONMENT,1843
ASSAULT,"FIREARM, DISCHARGING AT OCCUPIED BLDG, VEHICLE, OR AIRCRAFT",160
ASSAULT,"FIREARM, DISCHARGING IN GROSSLY NEGLIGENT MANNER",232
ASSAULT,INFLICT INJURY ON COHABITEE,17948
ASSAULT,"LASERS, DISCHARGING OR LIGHTS AT AIRCRAFT",7
ASSAULT,MAYHEM WITH A DEADLY WEAPON,97
ASSAULT,MAYHEM WITH A GUN,6
ASSAULT,MAYHEM WITH A KNIFE,48
ASSAULT,MAYHEM WITH BODILY FORCE,107
ASSAULT,"RESISTING PEACE OFFICER, CAUSING THEIR SERIOUS INJURY OR DEATH",240
ASSAULT,SHOOTING INTO INHABITED DWELLING OR OCCUPIED VEHICLE,770
ASSAULT,STALKING,2116
ASSAULT,TERRORIZING BY ARSON OR EXPLOSIVE DEVICE,10
ASSAULT,TERRORIZING BY MARKING PRIVATE PROPERTY,5
ASSAULT,THREAT OR FORCE TO RESIST EXECUTIVE OFFICER,669
ASSAULT,THREAT TO STATE OFFICIAL OR JUDGE,15
ASSAULT,THREATENING PHONE CALL(S),1953
ASSAULT,THREATENING SCHOOL OR PUBLIC EMPLOYEE,129
ASSAULT,THREATS AGAINST LIFE,34670
ASSAULT,THREATS TO SCHOOL TEACHERS,337
ASSAULT,TRESPASS WITHIN 30 DAYS OF CREDIBLE THREAT,17
ASSAULT,UNLAWFUL DISSUADING/THREATENING OF A WITNESS,237
ASSAULT,WILLFUL CRUELTY TO CHILD,296
BAD CHECKS,"CHECKS, NON-SUFFICIENT FUNDS (FELONY)",268
BAD CHECKS,"CHECKS, NON-SUFFICIENT FUNDS (MISDEMEANOR)",657
BRIBERY,BRIBERY OF EXECUTIVE OFFICER,19
BRIBERY,BRIBERY OF WITNESSES,318
BRIBERY,"CONCEAL CRIME OR WITHHOLD EVIDENCE, ACCEPTING PAYMENT TO",20
BRIBERY,"DISSUADING WITNESS, VICTIM",456
BURGLARY,"BURGLARY OF APARTMENT HOUSE, ATT FORCIBLE ENTRY",1616
BURGLARY,"BURGLARY OF APARTMENT HOUSE, FORCIBLE ENTRY",6747
BURGLARY,"BURGLARY OF APARTMENT HOUSE, UNLAWFUL ENTRY",11828
BURGLARY,"BURGLARY OF FLAT, ATTEMPTED FORCIBLE ENTRY",231
BURGLARY,"BURGLARY OF FLAT, FORCIBLE ENTRY",860
BURGLARY,"BURGLARY OF FLAT, UNLAWFUL ENTRY",1589
BURGLARY,"BURGLARY OF HOTEL ROOM, ATTEMPTED FORCIBLE ENTRY",36
BURGLARY,"BURGLARY OF HOTEL ROOM, FORCIBLE ENTRY",272
BURGLARY,"BURGLARY OF HOTEL ROOM, UNLAWFUL ENTRY",1570
BURGLARY,"BURGLARY OF RESIDENCE, ATTEMPTED FORCIBLE ENTRY",1546
BURGLARY,"BURGLARY OF RESIDENCE, FORCIBLE ENTRY",6814
BURGLARY,"BURGLARY OF RESIDENCE, UNLAWFUL ENTRY",7474
BURGLARY,"BURGLARY OF STORE, ATTEMPTED FORCIBLE ENTRY",456
BURGLARY,"BURGLARY OF STORE, FORCIBLE ENTRY",3657
BURGLARY,"BURGLARY OF STORE, UNLAWFUL ENTRY",5289
BURGLARY,"BURGLARY OF WAREHOUSE, ATTEMPTED FORCIBLE ENTRY",81
BURGLARY,"BURGLARY OF WAREHOUSE, FORCIBLE ENTRY",461
BURGLARY,"BURGLARY OF WAREHOUSE, UNLAWFUL ENTRY",311
BURGLARY,"BURGLARY, ATTEMPTED FORCIBLE ENTRY",1017
BURGLARY,"BURGLARY, FORCIBLE ENTRY",6733
BURGLARY,"BURGLARY, HOT PROWL, ATTEMPTED FORCIBLE ENTRY",716
BURGLARY,"BURGLARY, HOT PROWL, FORCIBLE ENTRY",2185
BURGLARY,"BURGLARY, HOT PROWL, UNLAWFUL ENTRY",4810
BURGLARY,"BURGLARY, UNLAWFUL ENTRY",8446
BURGLARY,"BURGLARY, VEHICLE (ARREST MADE)",2416
BURGLARY,"BURGLARY, VEHICLE, ATT. (ARREST MADE)",161
BURGLARY,"BURGLARY,APT UNDER CONSTRUCTION, ATT. FORCIBLE",23
BURGLARY,"BURGLARY,APT UNDER CONSTRUCTION, FORCIBLE ENTRY",145
BURGLARY,"BURGLARY,APT UNDER CONSTRUCTION, UNLAWFUL ENTRY",208
BURGLARY,"BURGLARY,BLDG. UNDER CONSTRUCTION, ATT. FORCIBLE",55
BURGLARY,"BURGLARY,BLDG. UNDER CONSTRUCTION, FORCIBLE ENTRY",738
BURGLARY,"BURGLARY,BLDG. UNDER CONSTRUCTION, UNLAWFUL ENTRY",847
BURGLARY,"BURGLARY,FLAT UNDER CONSTRUCTION, ATT. FORCIBLE",11
BURGLARY,"BURGLARY,FLAT UNDER CONSTRUCTION, FORCIBLE ENTRY",137
BURGLARY,"BURGLARY,FLAT UNDER CONSTRUCTION, UNLAWFUL ENTRY",141
BURGLARY,"BURGLARY,HOTEL UNDER CONSTRUCTION, ATT. FORCIBLE",1
BURGLARY,"BURGLARY,HOTEL UNDER CONSTRUCTION, FORCIBLE ENTRY",23
BURGLARY,"BURGLARY,HOTEL UNDER CONSTRUCTION, UNLAWFUL ENTRY",45
BURGLARY,"BURGLARY,RESIDENCE UNDER CONSTRT, ATT. FORCIBLE",94
BURGLARY,"BURGLARY,RESIDENCE UNDER CONSTRT, FORCIBLE ENTRY",982
BURGLARY,"BURGLARY,RESIDENCE UNDER CONSTRT, UNLAWFUL ENTRY",702
BURGLARY,"BURGLARY,STORE UNDER CONSTRUCTION, ATT. FORCIBLE",630
BURGLARY,"BURGLARY,STORE UNDER CONSTRUCTION, FORCIBLE ENTRY",4966
BURGLARY,"BURGLARY,STORE UNDER CONSTRUCTION, UNLAWFUL ENTRY",3875
BURGLARY,"BURGLARY,WAREHOUSE UNDER CONSTRT, ATT. FORCIBLE",3
BURGLARY,"BURGLARY,WAREHOUSE UNDER CONSTRT, FORCIBLE ENTRY",25
BURGLARY,"BURGLARY,WAREHOUSE UNDER CONSTRT, UNLAWFUL ENTRY",12
BURGLARY,SAFE BURGLARY,172
BURGLARY,SAFE BURGLARY OF A FLAT,8
BURGLARY,SAFE BURGLARY OF A HOTEL,21
BURGLARY,SAFE BURGLARY OF A RESIDENCE,84
BURGLARY,SAFE BURGLARY OF A RESIDENCE WITH EXPLOSIVES,1
BURGLARY,SAFE BURGLARY OF A STORE,231
BURGLARY,SAFE BURGLARY OF A WAREHOUSE,18
BURGLARY,SAFE BURGLARY OF A WAREHOUSE WITH EXPLOSIVES,3
BURGLARY,SAFE BURGLARY OF AN APARTMENT,18
BURGLARY,SAFE BURGLARY WITH EXPLOSIVES,2
DISORDERLY CONDUCT,COMMITTING PUBLIC NUISANCE,3254
DISORDERLY CONDUCT,"DISTURBANCE OF NON-RELIGIOUS, NON-POLITICAL ASSEMBLY",1
DISORDERLY CONDUCT,DISTURBING RELIGIOUS MEETINGS,11
DISORDERLY CONDUCT,DISTURBING THE PEACE,2169
DISORDERLY CONDUCT,"DISTURBING THE PEACE, COMMOTION",404
DISORDERLY CONDUCT,"DISTURBING THE PEACE, FIGHTING",1170
DISORDERLY CONDUCT,"DISTURBING THE PEACE, SWEARING",374
DISORDERLY CONDUCT,MAINTAINING A PUBLIC NUISANCE,902
DISORDERLY CONDUCT,MAINTAINING A PUBLIC NUISANCE AFTER NOTIFICATION,1755
DRIVING UNDER THE INFLUENCE,DRIVING WHILE UNDER THE INFLUENCE OF ALCOHOL,4837
DRIVING UNDER THE INFLUENCE,"DRIVING WHILE UNDER THE INFLUENCE OF ALCOHOL, W/INJURY",175
DRIVING UNDER THE INFLUENCE,DRIVING WHILE UNDER THE INFLUENCE OF DRUGS,627
DRIVING UNDER THE INFLUENCE,"DRIVING WHILE UNDER THE INFLUENCE OF DRUGS, W/INJURY",33
DRUG/NARCOTIC,"CONTROLLED SUBSTANCE VIOLATION, LOITERING FOR",1089
DRUG/NARCOTIC,"DRUG LAB APPARATUS, POSSESSION",4
DRUG/NARCOTIC,ENCOURAGE MINOR TO USE AMPHETAMINE,1
DRUG/NARCOTIC,ENCOURAGE MINOR TO USE BARBITUATES,9
DRUG/NARCOTIC,ENCOURAGE MINOR TO USE CONTROLLED SUBSTANCE,5
DRUG/NARCOTIC,ENCOURAGE MINOR TO USE HALLUCINOGENIC,1
DRUG/NARCOTIC,ENCOURAGE MINOR TO USE HEROIN,1
DRUG/NARCOTIC,ENCOURAGE MINOR TO USE METH-AMPHETAMINE,1
DRUG/NARCOTIC,ENCOURAGE MINOR TO USE OPIATES,1
DRUG/NARCOTIC,ENCOURAGING MINOR TO USE COCAINE,11
DRUG/NARCOTIC,ENCOURAGING MINOR TO USE MARIJUANA,26
DRUG/NARCOTIC,FAILURE TO REGISTER AS NARCOTICS ADDICT,35
DRUG/NARCOTIC,FORGE OR ALTER PRESCRIPTION,244
DRUG/NARCOTIC,FURNISHING MARIJUANA,168
DRUG/NARCOTIC,"HYPODERMIC NEEDLE OR SYRINGE, POSSESSION",144
DRUG/NARCOTIC,LOITERING WHERE NARCOTICS ARE SOLD/USED,743
DRUG/NARCOTIC,MAINTAINING PREMISE WHERE NARCOTICS ARE SOLD/USED,869
DRUG/NARCOTIC,MONEY OFFENSE RELATED TO NARCOTICS TRAFFICKING,57
DRUG/NARCOTIC,PLANTING/CULTIVATING MARIJUANA,601
DRUG/NARCOTIC,PLANTING/CULTIVATING PEYOTE,1
DRUG/NARCOTIC,POSSESSION OF AMPHETAMINE,305
DRUG/NARCOTIC,POSSESSION OF AMPHETAMINE FOR SALES,571
DRUG/NARCOTIC,POSSESSION OF BARBITUATES,12
DRUG/NARCOTIC,POSSESSION OF BARBITUATES FOR SALES,6
DRUG/NARCOTIC,POSSESSION OF BASE/ROCK COCAINE,14348
DRUG/NARCOTIC,POSSESSION OF BASE/ROCK COCAINE FOR SALE,8024
DRUG/NARCOTIC,POSSESSION OF COCAINE,3207
DRUG/NARCOTIC,POSSESSION OF COCAINE FOR SALES,1480
DRUG/NARCOTIC,POSSESSION OF CONTROLLED SUBSTANCE,4508
DRUG/NARCOTIC,POSSESSION OF CONTROLLED SUBSTANCE FOR SALE,2395
DRUG/NARCOTIC,POSSESSION OF HALLUCINOGENIC,316
DRUG/NARCOTIC,POSSESSION OF HALLUCINOGENIC FOR SALES,284
DRUG/NARCOTIC,POSSESSION OF HEROIN,4556
DRUG/NARCOTIC,POSSESSION OF HEROIN FOR SALES,2358
DRUG/NARCOTIC,POSSESSION OF MARIJUANA,11883
DRUG/NARCOTIC,POSSESSION OF MARIJUANA FOR SALES,5964
DRUG/NARCOTIC,POSSESSION OF METH-AMPHETAMINE,8747
DRUG/NARCOTIC,POSSESSION OF METH-AMPHETAMINE FOR SALE,2996
DRUG/NARCOTIC,POSSESSION OF METHADONE,181
DRUG/NARCOTIC,POSSESSION OF METHADONE FOR SALES,106
DRUG/NARCOTIC,POSSESSION OF NARCOTICS PARAPHERNALIA,22891
DRUG/NARCOTIC,POSSESSION OF OPIATES,326
DRUG/NARCOTIC,POSSESSION OF OPIATES FOR SALES,159
DRUG/NARCOTIC,POSSESSION OF OPIUM,72
DRUG/NARCOTIC,POSSESSION OF OPIUM DERIVATIVE,62
DRUG/NARCOTIC,POSSESSION OF OPIUM DERIVATIVE FOR SALES,20
DRUG/NARCOTIC,POSSESSION OF OPIUM FOR SALES,12
DRUG/NARCOTIC,"PRESCRIPTION, FORGE OR ALTER (4390 B&P)",35
DRUG/NARCOTIC,SALE OF AMPHETAMINE,201
DRUG/NARCOTIC,SALE OF BARBITUATES,4
DRUG/NARCOTIC,SALE OF BASE/ROCK COCAINE,9119
DRUG/NARCOTIC,SALE OF COCAINE,648
DRUG/NARCOTIC,SALE OF CONTROLLED SUBSTANCE,1642
DRUG/NARCOTIC,SALE OF HALLUCINOGENIC,63
DRUG/NARCOTIC,SALE OF HEROIN,1282
DRUG/NARCOTIC,SALE OF MARIJUANA,2992
DRUG/NARCOTIC,SALE OF METH-AMPHETAMINE,390
DRUG/NARCOTIC,SALE OF METHADONE,24
DRUG/NARCOTIC,SALE OF OPIATES,40
DRUG/NARCOTIC,SALE OF OPIUM,3
DRUG/NARCOTIC,SALE OF OPIUM DERIVATIVE,5
DRUG/NARCOTIC,SALES COCAINE BASE/SCHOOLYARD TRAFFICKING ACT VIO,46
DRUG/NARCOTIC,TRANSPORTAION OF CONTROLLED SUBSTANCE,168
DRUG/NARCOTIC,TRANSPORTATION OF AMPHETAMINE,8
DRUG/NARCOTIC,TRANSPORTATION OF COCAINE,567
DRUG/NARCOTIC,TRANSPORTATION OF HALLUCINOGENIC,14
DRUG/NARCOTIC,TRANSPORTATION OF HEROIN,130
DRUG/NARCOTIC,TRANSPORTATION OF MARIJUANA,750
DRUG/NARCOTIC,TRANSPORTATION OF METH-AMPHETAMINE,460
DRUG/NARCOTIC,TRANSPORTATION OF METHADONE,11
DRUG/NARCOTIC,TRANSPORTATION OF OPIATES,19
DRUG/NARCOTIC,TRANSPORTATION OF OPIUM,1
DRUG/NARCOTIC,TRANSPORTATION OF OPIUM DERIVATIVE,1
DRUG/NARCOTIC,UNDER INFLUENCE OF DRUGS IN A PUBLIC PLACE,621
DRUG/NARCOTIC,UNDER THE INFLUENCE OF CONTROLLED SUBSTANCES,437
DRUG/NARCOTIC,VISITING WHERE DRUGS ARE USED OR SMOKED,147
DRUNKENNESS,UNDER INFLUENCE OF ALCOHOL IN A PUBLIC PLACE,9826
EMBEZZLEMENT,EMBEZZLED VEHICLE,418
EMBEZZLEMENT,EMBEZZLEMENT (GENERAL),210
EMBEZZLEMENT,"EMBEZZLEMENT, GRAND THEFT",738
EMBEZZLEMENT,"EMBEZZLEMENT, GRAND THEFT BY BROOKERS/AGENTS",52
EMBEZZLEMENT,"EMBEZZLEMENT, GRAND THEFT BY COLLECTOR",7
EMBEZZLEMENT,"EMBEZZLEMENT, GRAND THEFT BY EMPLOYEE",1094
EMBEZZLEMENT,"EMBEZZLEMENT, GRAND THEFT BY PROPERTY CARRIER",4
EMBEZZLEMENT,"EMBEZZLEMENT, GRAND THEFT LEASED PROPERTY",42
EMBEZZLEMENT,"EMBEZZLEMENT, GRAND THEFT PRIVATE PROPERTY",19
EMBEZZLEMENT,"EMBEZZLEMENT, GRAND THEFT PUBLIC/PRIVATE OFFICIAL",10
EMBEZZLEMENT,"EMBEZZLEMENT, PETTY THEFT",114
EMBEZZLEMENT,"EMBEZZLEMENT, PETTY THEFT BY BROOKERS/AGENTS",5
EMBEZZLEMENT,"EMBEZZLEMENT, PETTY THEFT BY COLLECTOR",1
EMBEZZLEMENT,"EMBEZZLEMENT, PETTY THEFT BY EMPLOYEE",260
EMBEZZLEMENT,"EMBEZZLEMENT, PETTY THEFT OF LEASED PROPERTY",3
EMBEZZLEMENT,"EMBEZZLEMENT, PETTY THEFT PRIVATE PROPERTY",6
EMBEZZLEMENT,"EMBEZZLEMENT, PETTY THEFT PUBLIC/PRIVATE OFFICIAL",5
EXTORTION,ATTEMPTED EXTORTION,344
EXTORTION,EXTORTION,397
FAMILY OFFENSES,ABANDONMENT OF CHILD,206
FAMILY OFFENSES,"CHILDREN, ABANDONMENT & NEGLECT OF (GENERAL)",300
FAMILY OFFENSES,CONCEALMENT/REMOVAL OF CHILD WITHOUT CONSENT,32
FAMILY OFFENSES,DESERTION OF CHILD,270
FAMILY OFFENSES,FAILURE TO PROVIDE FOR CHILD,93
FAMILY OFFENSES,FAILURE TO PROVIDE FOR PARENTS,3
FAMILY OFFENSES,HARASSING CHILD OR WARD BECAUSE OF PERSON'S EMPLOYMENT,1
FAMILY OFFENSES,IMMORAL ACTS OR DRUNK IN PRESENCE OF CHILD,43
FAMILY OFFENSES,MINOR WITHOUT PROPER PARENTAL CARE,235
FORGERY/COUNTERFEITING,"CHECKS OR LEGAL INSTRUMENTS, UTTERING FORGED",801
FORGERY/COUNTERFEITING,"CHECKS, FORGERY (FELONY)",5583
FORGERY/COUNTERFEITING,"CHECKS, FORGERY (MISDEMEANOR)",264
FORGERY/COUNTERFEITING,"CHECKS, MAKE OR PASS FICTITIOUS",3703
FORGERY/COUNTERFEITING,"CHECKS, POSSESSION WITH INTENT TO PASS",877
FORGERY/COUNTERFEITING,"CITIZENSHIP DOCUMENT, USING FALSE",2
FORGERY/COUNTERFEITING,"CITIZENSHIP OR ALIEN REGISTRATION, MAKING FALSE DOCUMENT",6
FORGERY/COUNTERFEITING,"COUNTERFEITING, COINS OR NOTES",2229
FORGERY/COUNTERFEITING,"COUNTERFEITING, PLATES OR DIES",5
FORGERY/COUNTERFEITING,"COUNTERFEITING, POSSESSION COINS OR NOTES",805
FORGERY/COUNTERFEITING,FALSIFICATION OF MEDICAL RECORDS,9
FORGERY/COUNTERFEITING,FALSIFYING JUDICIAL & PUBLIC RECORDS & DOCUMENTS,46
FORGERY/COUNTERFEITING,"FINANCIAL STATEMENTS, FALSE",19
FORGERY/COUNTERFEITING,FORGERY & COUNTERFEITING (GENERAL),503
FORGERY/COUNTERFEITING,"FORGERY, DRIVERS LICENSE OR ID-CARD",3185
FORGERY/COUNTERFEITING,"FORGERY, FALSE ENTRIES IN RECORDS OR RETURNS",1178
FORGERY/COUNTERFEITING,"FORGERY, GOVERNMENT OR CORPORATE SEALS",69
FORGERY/COUNTERFEITING,"FORGERY, NOTES",1751
FORGERY/COUNTERFEITING,"FORGERY, POSSESSION DRIVERS LICENSE OR ID-CARD",145
FORGERY/COUNTERFEITING,"IDENTIFICATION, GOVERNMENT, POSSESS, MAKE OR SELL FALSE",101
FORGERY/COUNTERFEITING,MANUFACTURE OR SALE OF COUNTERFEIT GOODS,75
FORGERY/COUNTERFEITING,"MONEY, CHANGING FACE AMOUNT",1673
FORGERY/COUNTERFEITING,"TELEPHONE OR TELEGRAPH MESSAGE, SENDING FALSE",21
FRAUD,"ACCESS CARD INFORMATION, PUBLICATION OF",19
FRAUD,"ACCESS CARD INFORMATION, THEFT OF",949
FRAUD,"AUDIOVISUAL (VIDEO OR SOUND) RECORDINGS, UNAUTHORIZED",26
FRAUD,"CABLE TV CONNECTION OR DECODING DEVICE, UNAUTHORIZED",6
FRAUD,"CELLULAR OR CORDLESS PHONE COMMUNICATIONS, INTERCEPTING",86
FRAUD,"CREDIT CARD, INCOMPLETE OR COUNTERFEIT",130
FRAUD,"CREDIT CARD, THEFT BY USE OF",22079
FRAUD,"CREDIT CARD, THEFT OF",1004
FRAUD,CRIMES AGAINST REVENUE & PROPERTY OF STATE,7
FRAUD,CRIMES INVOLVING RECEIPTS OR TITLES,1
FRAUD,DEFRAUDING AN INNKEEPER,1608
FRAUD,DEFRAUDING OF VEHICLE REPAIRMAN,26
FRAUD,"EAVESDROPPING DEVICES, SALE OR USE",6
FRAUD,"FALSE CLAIMS, PRESENTING TO GOVERNMENT",113
FRAUD,FALSE ID TO PEACE OFFICER,3674
FRAUD,"FALSE PRETENSES, GRAND THEFT",1592
FRAUD,"FALSE PRETENSES, PETTY THEFT",611
FRAUD,FALSE REPORT OF EMERGENCY,201
FRAUD,FALSE REPORT OF POLICE MISCONDUCT,4
FRAUD,FALSE REPRESENTATION TO SECONDHAND DEALER,1
FRAUD,"FORGERY, CREDIT CARD",1221
FRAUD,FRAUDULENT AUCTION,20
FRAUD,FRAUDULENT CREDIT APPLICATION,2487
FRAUD,FRAUDULENT USE OF AUTOMATED TELLER CARD,3744
FRAUD,IMPERSONATING A POLICE OFFICER,216
FRAUD,IMPERSONATING FIRE DEPARTMENT MEMBER,3
FRAUD,IMPERSONATING PUBLIC UTILITY MEMBER,15
FRAUD,MERCHANDISE TITLE DOCUMENT FRAUD,1
FRAUD,"PRIVACY, INVASION OF  (GENERAL)",49
FRAUD,"PUBLIC UTILITY INFORMATION, FRAUDULENTLY OBTAINING",1
FRAUD,PUTTING SLUGS IN COIN OPERATED MACHINES,11
FRAUD,PUTTING SLUGS IN PARKING METERS,4
FRAUD,PUTTING SLUGS IN TELEPHONE BOX,12
FRAUD,REAL ESTATE FRAUD,42
FRAUD,"SHORT CHANGE, GRAND THEFT",8
FRAUD,"SHORT CHANGE, PETTY THEFT",63
FRAUD,"TELEPHONE OR TELEGRAPH MESSAGES, ALTERING",4
FRAUD,"TRICK AND DEVICE, ATTEMPTED",179
FRAUD,"TRICK AND DEVICE, GRAND THEFT",819
FRAUD,"TRICK AND DEVICE, PETTY THEFT",495
FRAUD,"VETERAN OR EX-SERVICEMAN, FALSE REPRESENTATION AS",1
FRAUD,"WIRETAPS, UNAUTHORIZED",4
GAMBLING,BOOKMAKING,5
GAMBLING,GAMBLING,243
GAMBLING,GAMING & HORSE RACING (GENERAL),3
GAMBLING,POSSESSION OF GAMBLING DEVICES,51
GAMBLING,POSSESSION OF GAMBLING PARAPHERNALIA,46
KIDNAPPING,"ATTEMPTED KIDNAPPING, ADULT VICTIM",134
KIDNAPPING,"ATTEMPTED KIDNAPPING, JUVENILE VICTIM",95
KIDNAPPING,CHILD STEALING,684
KIDNAPPING,FALSE IMPRISONMENT,3026
KIDNAPPING,"KIDNAPPER, POSING AS",4
KIDNAPPING,KIDNAPPING DURING CARJACKING,16
KIDNAPPING,KIDNAPPING DURING ROBBERY,117
KIDNAPPING,"KIDNAPPING, ADULT VICTIM",1041
KIDNAPPING,"KIDNAPPING, JUVENILE VICTIM",229
LARCENY/THEFT,ATTEMPTED AUTO STRIP,137
LARCENY/THEFT,ATTEMPTED GRAND THEFT FROM PERSON,230
LARCENY/THEFT,ATTEMPTED GRAND THEFT PICKPOCKET,82
LARCENY/THEFT,ATTEMPTED GRAND THEFT PURSESNATCH,81
LARCENY/THEFT,ATTEMPTED MOTORCYCLE STRIP,8
LARCENY/THEFT,ATTEMPTED PETTY THEFT OF PROPERTY,375
LARCENY/THEFT,ATTEMPTED SHOPLIFTING,573
LARCENY/THEFT,ATTEMPTED THEFT COIN OPERATED MACHINE,49
LARCENY/THEFT,ATTEMPTED THEFT FROM A BUILDING,519
LARCENY/THEFT,ATTEMPTED THEFT FROM LOCKED VEHICLE,5363
LARCENY/THEFT,ATTEMPTED THEFT FROM UNLOCKED VEHICLE,325
LARCENY/THEFT,ATTEMPTED THEFT OF A BICYCLE,231
LARCENY/THEFT,ATTEMPTED THEFT PHONE BOOTH,3
LARCENY/THEFT,EMBEZZLEMENT FROM DEPENDENT OR ELDER ADULT BY CARETAKER,387
LARCENY/THEFT,GRAND THEFT AUTO STRIP,1384
LARCENY/THEFT,GRAND THEFT BICYCLE,6190
LARCENY/THEFT,GRAND THEFT BY PROSTITUTE,98
LARCENY/THEFT,GRAND THEFT COIN OPERATED MACHINE,86
LARCENY/THEFT,GRAND THEFT FROM A BUILDING,22503
LARCENY/THEFT,GRAND THEFT FROM LOCKED AUTO,178836
LARCENY/THEFT,GRAND THEFT FROM PERSON,18119
LARCENY/THEFT,GRAND THEFT FROM UNLOCKED AUTO,15523
LARCENY/THEFT,GRAND THEFT MOTORCYCLE STRIP,87
LARCENY/THEFT,GRAND THEFT OF PROPERTY,29420
LARCENY/THEFT,GRAND THEFT PHONE BOOTH,15
LARCENY/THEFT,GRAND THEFT PICKPOCKET,13650
LARCENY/THEFT,GRAND THEFT PURSESNATCH,1589
LARCENY/THEFT,GRAND THEFT SHOPLIFTING,5452
LARCENY/THEFT,"LICENSE PLATE OR TAB, THEFT OF",395
LARCENY/THEFT,LOOTING DURING STATE OF EMERGENCY,4
LARCENY/THEFT,"LOST PROPERTY, GRAND THEFT",1536
LARCENY/THEFT,"LOST PROPERTY, PETTY THEFT",3459
LARCENY/THEFT,PETTY THEFT AUTO STRIP,1239
LARCENY/THEFT,PETTY THEFT BICYCLE,4326
LARCENY/THEFT,PETTY THEFT COIN OPERATED MACHINE,175
LARCENY/THEFT,PETTY THEFT FROM A BUILDING,25728
LARCENY/THEFT,PETTY THEFT FROM LOCKED AUTO,51946
LARCENY/THEFT,PETTY THEFT FROM UNLOCKED AUTO,6907
LARCENY/THEFT,PETTY THEFT MOTORCYCLE STRIP,59
LARCENY/THEFT,PETTY THEFT OF PROPERTY,46114
LARCENY/THEFT,PETTY THEFT PHONE BOOTH,43
LARCENY/THEFT,PETTY THEFT SHOPLIFTING,24478
LARCENY/THEFT,PETTY THEFT WITH PRIOR,8207
LARCENY/THEFT,THEFT FROM MERCHANT OR LIBRARY,1047
LARCENY/THEFT,THEFT OF ANIMALS (GENERAL),198
LARCENY/THEFT,THEFT OF CHECKS OR CREDIT CARDS,787
LARCENY/THEFT,THEFT OF COMPUTERS OR CELL PHONES,1795
LARCENY/THEFT,"THEFT OF TELECOMMUNICATION SERVICES, INCL. CLONE PHONE",37
LARCENY/THEFT,THEFT OF UTILITY SERVICES,112
LARCENY/THEFT,THEFT OF WRITTEN INSTRUMENT,20
LARCENY/THEFT,"THEFT, ANIMAL, ATT.",2
LARCENY/THEFT,"THEFT, BICYCLE, <$50, NO SERIAL NUMBER",91
LARCENY/THEFT,"THEFT, BICYCLE, <$50, SERIAL NUMBER KNOWN",61
LARCENY/THEFT,"THEFT, BOAT",23
LARCENY/THEFT,"THEFT, DRUNK ROLL, $200-$400",49
LARCENY/THEFT,"THEFT, DRUNK ROLL, $50-$200",29
LARCENY/THEFT,"THEFT, DRUNK ROLL, <$50",23
LARCENY/THEFT,"THEFT, DRUNK ROLL, >$400",35
LARCENY/THEFT,"THEFT, DRUNK ROLL, ATT.",4
LARCENY/THEFT,"THEFT, GRAND, AGRICULTURAL",4
LARCENY/THEFT,"THEFT, GRAND, BY FIDUCIARY, >$400 IN 12 MONTHS",35
LARCENY/THEFT,"THEFT, GRAND, OF FIREARM",152
LARCENY/THEFT,"TRADE SECRETS, THEFT OR UNAUTHORIZED COPYING",13
LIQUOR LAWS,"ALCOHOLIC BEVERAGE, PROCURING SALE OF",2
LIQUOR LAWS,CONSUMING ALCOHOL IN PUBLIC VIEW,2108
LIQUOR LAWS,FALSE EVIDENCE OF AGE BY MINOR,22
LIQUOR LAWS,LICENSE REQUIRED TO SELL ALCOHOL,63
LIQUOR LAWS,MINOR ON ON-SALE LICENSED PREMISE,37
LIQUOR LAWS,MINOR PURCHASING ALCOHOL,23
LIQUOR LAWS,MISCELLANEOUS LIQOUR LAW VIOLATION,569
LIQUOR LAWS,POSSESSION OF ALCOHOL BY MINOR,698
LIQUOR LAWS,SALE OF ALCOHOL AFTER HOURS,39
LIQUOR LAWS,SALE OF ALCOHOL BY MINOR,13
LIQUOR LAWS,SALE OF ALCOHOL TO MINOR,417
LIQUOR LAWS,SALE OF ALCOHOL TO MINOR IN BAR,10
LIQUOR LAWS,SELL OR FURNISH ALCOHOL TO INTOXICATED PERSON,21
LIQUOR LAWS,UNLAWFUL TRANSPORTATION OF ALCOHOL,61
LOITERING,BEGGING,877
LOITERING,"CASH DISPENSING MACHINES (ATM), LOITERING PROHIBI",66
LOITERING,INCITING TO RIOT,52
LOITERING,LODGING IN PARK,25
LOITERING,LOITERING,779
LOITERING,LOITERING ABOUT SCHOOL/PLAYGROUND,74
LOITERING,LOITERS AROUND PUBLIC TOILET FOR LEWD ACT,40
LOITERING,"OBSTRUCTING HEALTH FACILITY, PLACE OF WORSHIP, OR SCHOOL",4
LOITERING,OBSTRUCTING PUBLIC THOROUGHFARE,332
LOITERING,REFUSING TO DISPERSE UPON LAWFUL COMMAND,43
LOITERING,REMAINING ON CAMPUS WITHOUT CONSENT,44
LOITERING,UNLAWFUL ASSEMBLY,94
MISSING PERSON,FOUND PERSON,24539
MISSING PERSON,MISSING ADULT,20574
MISSING PERSON,MISSING JUVENILE,19848
NON-CRIMINAL,ACCIDENTAL BURNS,9
NON-CRIMINAL,ACCIDENTAL LACERATIONS,1
NON-CRIMINAL,ACCIDENTAL SHOOTING,26
NON-CRIMINAL,AIDED CASE,14250
NON-CRIMINAL,AIDED CASE -PROPERTY FOR DESTRUCTION,2317
NON-CRIMINAL,"AIDED CASE, DOG BITE",3543
NON-CRIMINAL,"AIDED CASE, INJURED PERSON",2688
NON-CRIMINAL,"AIDED CASE, MENTAL DISTURBED",56313
NON-CRIMINAL,"AIDED CASE, SICK PERSON",571
NON-CRIMINAL,AUTO IMPOUNDED,24
NON-CRIMINAL,CASE CLOSURE,6021
NON-CRIMINAL,"CIVIL SIDEWALKS, BOOKING",131
NON-CRIMINAL,"CIVIL SIDEWALKS, CITATION",3040
NON-CRIMINAL,"CIVIL SIDEWALKS, VIOLATION",91
NON-CRIMINAL,"CIVIL SIDEWALKS, WARNING",2317
NON-CRIMINAL,COURTESY REPORT,2466
NON-CRIMINAL,"DEATH REPORT, CAUSE UNKNOWN",10735
NON-CRIMINAL,"DEATH REPORT, IN CUSTODY",14
NON-CRIMINAL,"DEATH REPORT, NATURAL CAUSES",2338
NON-CRIMINAL,"DEATH, ACCIDENTAL",40
NON-CRIMINAL,"DEATH, NON-MANSLAUGHTER AUTO ACCIDENT",31
NON-CRIMINAL,"DEMONSTRATION, VIDEO EVIDENCE, MISC. INVESTIGATION",27
NON-CRIMINAL,FIRE REPORT,2028
NON-CRIMINAL,FOUND PROPERTY,33383
NON-CRIMINAL,IMPOUNDED VEHICLE,792
NON-CRIMINAL,"LICENSE PLATE, FOUND",356
NON-CRIMINAL,"LICENSE PLATE, RECOVERED",945
NON-CRIMINAL,LOCATED PROPERTY,1725
NON-CRIMINAL,LOST PROPERTY,77956
NON-CRIMINAL,MEGAN'S LAW NOTIFICATION,18
NON-CRIMINAL,MISPLACED VEHICLE,132
NON-CRIMINAL,PROPERTY FOR IDENTIFICATION,2777
NON-CRIMINAL,SEARCH WARRANT SERVICE,1933
NON-CRIMINAL,SHELTER,770
NON-CRIMINAL,"STAY AWAY OR COURT ORDER, NON-DV RELATED",4311
NON-CRIMINAL,TARASOFF REPORT,1594
NON-CRIMINAL,TRAFFIC ACCIDENT,1238
NON-CRIMINAL,"TRUANT, HABITUAL",66
NON-CRIMINAL,TURNED IN GUN,1284
NON-CRIMINAL,YOUTH COURT,22
OTHER OFFENSES,ABORTION,16
OTHER OFFENSES,ACTS AGAINST PUBLIC TRANSIT,682
OTHER OFFENSES,ADVERTISING DISTRIBUTORS PERMIT VIOLATION,67
OTHER OFFENSES,AFFIXING ADVERTISMENTS TO POLES,8
OTHER OFFENSES,AGGRESSIVE SOLICITING,339
OTHER OFFENSES,AID OR HARBOR FELON,59
OTHER OFFENSES,"ANIMAL, FIGHTING",14
OTHER OFFENSES,"ANIMAL, WITHOUT PROPER CARE OR ATTENTION",40
OTHER OFFENSES,"BATHROOM HOLE, LOOKING THROUGH",13
OTHER OFFENSES,BEYOND PARENTAL CONTROL,586
OTHER OFFENSES,"CHOP SHOP, OWN OR OPERATE",2
OTHER OFFENSES,"COMPUTER SYSTEM, ACCESSING, COPYING, OR DAMAGING",132
OTHER OFFENSES,CONSPIRACY,7682
OTHER OFFENSES,CONTRIBUTING TO THE DELINQUENCY OF MINOR,544
OTHER OFFENSES,CRUELTY TO ANIMALS,375
OTHER OFFENSES,CURFEW VIOLATION,15
OTHER OFFENSES,DANGER OF LEADING IMMORAL LIFE,1021
OTHER OFFENSES,DEFRAUDING TAXI DRIVER,500
OTHER OFFENSES,DESTITUTE MINOR,6
OTHER OFFENSES,DISCHARGING OFFENSIVE OR INJURIOUS SUBSTANCE IN PUBLIC AREA,15
OTHER OFFENSES,DISPLAY & SALE OF SPRAY PAINT & MARKER PENS,26
OTHER OFFENSES,DISRUPTS SCHOOL ACTIVITIES,464
OTHER OFFENSES,"DOG OR CAT, ABANDONMENT OF",6
OTHER OFFENSES,"DOG, BARKING",46
OTHER OFFENSES,"DOG, FIGHTING;  OWNING, FIGHTING, OR ATTENDING FIGHT",3
OTHER OFFENSES,"DOG, STRAY OR VICIOUS",130
OTHER OFFENSES,"DRIVERS LICENSE, SUSPENDED OR REVOKED",62534
OTHER OFFENSES,DRIVES VEHICLE ALONG TRACK OF RAILROAD,45
OTHER OFFENSES,"DRIVING, DRAG RACING",10
OTHER OFFENSES,"DRIVING, RECKLESS, WITH INJURY",39
OTHER OFFENSES,"DRUG OFFENDER, PRESENCE  NEAR SCHOOL GROUNDS",8
OTHER OFFENSES,DUMPING OF OFFENSIVE MATTER,151
OTHER OFFENSES,ENCOUNTER STUDIO ORDINANCE VIOLATION,2
OTHER OFFENSES,ESCAPE FROM HOSPITAL WITH FORCE,2
OTHER OFFENSES,ESCAPE FROM JAIL,39
OTHER OFFENSES,ESCAPE OF PRISONER WHILE HOSPITALIZED,12
OTHER OFFENSES,ESCAPE OR ASSISTING ESCAPE,23
OTHER OFFENSES,"ESCAPEE, JUVENILE",37
OTHER OFFENSES,ESCAPES,7
OTHER OFFENSES,EVADING A POLICE OFFICER RECKLESSLY,947
OTHER OFFENSES,"EVADING A POLICE OFFICER, INJURY OR DEATH",36
OTHER OFFENSES,EVADING A POLICE VEHICLE OR BICYCLE,197
OTHER OFFENSES,EVADING PAYMENT OF RAILROAD FARE,75
OTHER OFFENSES,FAILURE TO HEED RED LIGHT AND SIREN,170
OTHER OFFENSES,FAILURE TO REGISTER AS SEX OFFENDER,1653
OTHER OFFENSES,FALSE EVIDENCE OF VEHICLE REGISTRATION,2800
OTHER OFFENSES,FALSE FIRE ALARM,207
OTHER OFFENSES,FALSE PERSONATION,4750
OTHER OFFENSES,FALSE PERSONATION AND CHEAT CRIMES (GENERAL),533
OTHER OFFENSES,FALSE PERSONATION TO RECEIVE MONEY OR PROPERTY,8134
OTHER OFFENSES,FALSE REPORT OF BOMB,683
OTHER OFFENSES,FALSE REPORT OF CRIME,267
OTHER OFFENSES,"FIREARMS, SEIZING AT SCENE OF DV",34
OTHER OFFENSES,"FIREWORKS, THROW AT PERSON OR DISCHARGE IN CROWD",17
OTHER OFFENSES,"FOOD STAMPS, MISUSE OF",6
OTHER OFFENSES,"FOOD STAMPS, UNLAWFUL USE BY RETAILER",2
OTHER OFFENSES,FORTUNE TELLING,29
OTHER OFFENSES,"FRAUDULENT GAME OR TRICK, OBTAINING MONEY OR PROPERTY",3269
OTHER OFFENSES,"GUIDE DOG, INTERFERING WITH",7
OTHER OFFENSES,HABITUAL TRUANT,274
OTHER OFFENSES,HARASSING PHONE CALLS,5049
